{
  "schema_version": "0.2",
  "survey_id": "SUR-CAL-002",
  "title": "Quadrant Calibration Survey 002",
  "survey_type": "Instrument Calibration Survey",
  "scientific_question": "Given a known reference, how does a particular observer–instrument measurement system behave?",
  "observer_ids": [
    "OBS-0001",
    "OBS-0002"
  ],
  "protocol_id": null,
  "protocol_version": null,
  "observing_location": {
    "latitude_deg": 34.40732,
    "longitude_deg": -118.56714,
    "elevation_m": null,
    "coordinate_reference_system": "WGS84"
  },
  "observation_tables": [
    {
      "path": "observations/quadrant-calibration-observations.csv",
      "instrument_instance_id": "INS-0002",
      "observation_specification": {
        "name": "quadrant-calibration-observation",
        "version": "0.1"
      }
    }
  ],
  "site_id": "SITE-0001",
  "started_at": "2026-07-25T02:27:15Z",
  "ended_at": "2026-07-25T03:05:26Z",
  "submitted_at": null,
  "attachments": [
    {
      "attachment_id": "ATT-0001",
      "path": "attachments/calibration-range.jpg",
      "description": "Photograph of the quadrant calibration range and marked reference levels.",
      "media_type": "image/jpeg",
      "sha256": "d13d69d909c9744ef388e181fbebd4994f4868fad5ae1a5ff196ae7a1b09fdd1"
    },
    {
      "attachment_id": "ATT-0002",
      "path": "attachments/calibration_geometry.yaml",
      "description": "Contributor-supplied calibration geometry and site metadata.",
      "media_type": "application/yaml",
      "sha256": "e839b353fc5bda2195a7609e0835a165b2faf291e3b4c24e0b211cf9a86baac3"
    },
    {
      "attachment_id": "ATT-0003",
      "path": "attachments/raw_values.csv",
      "description": "Original contributor-supplied raw readings.",
      "media_type": "text/csv",
      "sha256": "63a157bbda53266a4c0b4fa58a0f95564dff033ceb6e97f84c2614fb87154e61"
    },
    {
      "attachment_id": "ATT-0004",
      "path": "attachments/working_values.csv",
      "description": "Contributor-supplied working table before calibration-specific normalization.",
      "media_type": "text/csv",
      "sha256": "1c0f98eb147b81fd5b510f143c3f7a3e6def8e17e47a3f7b22c18026fe2e88f8"
    },
    {
      "attachment_id": "ATT-0005",
      "path": "attachments/working_values_quadrant_calibration.csv",
      "description": "Normalized working table used to construct the canonical calibration observation table.",
      "media_type": "text/csv",
      "sha256": "25fc6b8aae3c2cee6e129ed8e3575a6eb77059b1b031214e12a2d6a0f7a1838f"
    },
    {
      "attachment_id": "ATT-0006",
      "path": "attachments/calibration.md",
      "description": "Quadrant calibration protocol and campaign guidance supplied with the survey.",
      "media_type": "text/markdown",
      "sha256": "35dfcfb3f122a55bb6e3b225963e85181e8af3632aa6b7b8d329d0b45fa06089"
    },
    {
      "attachment_id": "ATT-0007",
      "path": "attachments/source-specifications/quadrant-calibration-observation.md",
      "description": "Quadrant Calibration Observation Specification Draft 0.1.",
      "media_type": "text/markdown",
      "sha256": "166c5e29bca0c723e5f612a05adf8889dd0dab944f848a35b9d03e99e7b3a28a"
    },
    {
      "attachment_id": "ATT-0008",
      "path": "attachments/source-specifications/quadrant-calibration-observation.schema.json",
      "description": "Quadrant Calibration Observation JSON Schema Draft 0.1.",
      "media_type": "application/schema+json",
      "sha256": "ba7c0da7b9a8c5eb4c48c08bc0bcfb0cc4ac5d9b66c351fb01737ff53c654063"
    },
    {
      "attachment_id": "ATT-0009",
      "path": "attachments/source-specifications/quadrant-observation.md",
      "description": "General Quadrant Observation Specification supplied during archive construction.",
      "media_type": "text/markdown",
      "sha256": "0e0b57dd336d92beaa7e6cf13fe481480213dbdce11b03d266c0e09512ca91d1"
    },
    {
      "attachment_id": "ATT-0010",
      "path": "attachments/source-specifications/quadrant-observation.schema.json",
      "description": "General Quadrant Observation JSON Schema supplied during archive construction.",
      "media_type": "application/schema+json",
      "sha256": "6c1b912795934fae33278509bc8495d1ec7db23d76d427bd0c1278401575d7ff"
    },
    {
      "attachment_id": "ATT-0011",
      "path": "attachments/source-specifications/survey-specification.md",
      "description": "Kepler Survey Specification supplied during archive construction.",
      "media_type": "text/markdown",
      "sha256": "9216b66c55f7e1f29e3edca63175a0b9d93e5cf0a645d349010ec991ab82abf6"
    },
    {
      "attachment_id": "ATT-0012",
      "path": "attachments/source-specifications/survey.schema.json",
      "description": "Kepler Survey Metadata JSON Schema supplied during archive construction.",
      "media_type": "application/schema+json",
      "sha256": "5fac5480b62c6acec745eed307ba33d8c4fc8aa1e5515c19e56445fa56fcb9a8"
    }
  ]
}
